{
  "keyword": "wireless earbuds",
  "search_volume": 4363,
  "keyword_difficulty": 16.93,
  "avg_cpc": 2.25,
  "title": "Unleashing the Ultimate Freedom: A Guide to Wireless Earbuds",
  "outline": [
    "Cutting-edge Technology for Seamless Connectivity",
    "Ergonomic Design for Comfort and Style",
    "Immersive Sound Quality for an Unmatched Audio Experience"
  ],
  "content": "# Unleashing the Ultimate Freedom: A Guide to Wireless Earbuds\n\nIn today's fast-paced world, wireless earbuds have become a staple accessory for music lovers, fitness enthusiasts, and professionals on the go. With a search volume of 4363, a keyword difficulty of 16.93, and an average CPC of $2.25, it's evident that the demand for wireless earbuds is soaring. Let's dive into the world of wireless earbuds and explore the top picks that offer unparalleled convenience and superior sound quality.\n\n## Cutting-edge Technology for Seamless Connectivity\n\nGone are the days of tangled wires and limited mobility. Wireless earbuds harness the power of Bluetooth technology to provide a seamless listening experience. Whether you're hitting the gym or commuting to work, these earbuds offer freedom of movement without compromising on audio quality. {[Affiliate Link](https://example.com/affiliate1)} features the latest advancements in wireless connectivity, ensuring a stable connection and crystal-clear sound for hours on end.\n\n## Ergonomic Design for Comfort and Style\n\nComfort is key when it comes to choosing the perfect pair of wireless earbuds. With a snug fit and lightweight design, {[Affiliate Link](https://example.com/affiliate2)} prioritizes comfort without sacrificing style. These earbuds are ergonomically crafted to stay securely in place, making them ideal for long listening sessions or intense workouts. Say goodbye to bulky headphones and hello to a sleek, modern audio solution that complements your lifestyle.\n\n## Immersive Sound Quality for an Unmatched Audio Experience\n\nExperience music like never before with wireless earbuds that deliver immersive sound quality. {[Affiliate Link](https://example.com/affiliate3)} combines cutting-edge audio technology with noise-cancellation features to transport you to another world of musical bliss. Whether you're listening to your favorite playlist or taking calls on the go, these earbuds offer unparalleled clarity and depth, elevating your audio experience to new heights.\n\nIn conclusion, wireless earbuds are not just a trend but a lifestyle choice for those who value convenience, style, and exceptional sound quality. With a plethora of options available in the market, finding the perfect pair to suit your needs has never been easier. Embrace the wireless revolution and enjoy the ultimate freedom that wireless earbuds bring to your everyday life.",
  "generated_at": "2025-06-06T09:21:04.078225Z"
}
